Year,Content
13th century - 14th century:,Worm gear cotton gin in India.[368]
1277:,"Land mine in Song dynasty China: Textual evidence suggests that the first use of a land mine in history is by a Song dynasty brigadier general known as Lou Qianxia, who uses an 'enormous bomb' (huo pao) to kill Mongol soldiers invading Guangxi in 1277.[369]"
1286:,Eyeglasses in Italy[370]
Early 14th century – Mid 14th century:,Multistage rocket in Ming dynasty China described in Huolongjing by Jiao Yu.
By at least 1326:,Cannon in Ming dynasty China[371]
14th century:,Painting Canvas was first used in Italy.[372]
14th century:,Jacob's staff described by Levi ben Gerson
14th century:,"Naval mine in Ming dynasty China: Mentioned in the Huolongjing military manuscript written by Jiao Yu (fl. 14th to early 15th century) and Liu Bowen (1311–1375), describing naval mines used at sea or on rivers and lakes, made of wrought iron and enclosed in an ox bladder. A later model is documented in Song Yingxing's encyclopedia written in 1637.[373]"
14th century:,Bidriware in the Bahmani Sultanate in India.[374]
Early 15th century:,Coil spring in Europe[376]
15th century:,Mainspring in Europe[376]
15th century:,Rifle in Europe
1420s:,"Brace in Flanders, Holy Roman Empire[377]"
1439:,"Printing press in Mainz, Germany: The printing press is invented in the Holy Roman Empire by Johannes Gutenberg before 1440, based on existing screw presses. The first confirmed record of a press appeared in a 1439 lawsuit against Gutenberg.[378]"
Mid 15th century:,"The Arquebus (also spelled Harquebus) is invented, possibly in Spain.[379][380]"
1480s:,Mariner's astrolabe in Portuguese circumnavigation of Africa[381]
16th century:,"Chintz or printed clothing in Golconda, India[382]"
16th century:,"Hookah by Irfan Shaikh, at the court of the Mughal emperor Akbar I (1542–1605)."
1560:,"Floating Dry Dock in Venice, Venetian Republic[385]"
1569:,Mercator Projection map created by Gerardus Mercator
1589:,Stocking frame: Invented by William Lee.[386]
1594:,Backstaff: Invented by Captain John Davis.
By at least 1597:,Revolver: Invented by Hans Stopler.
1605:,Newspaper (Relation): Johann Carolus in Strassburg (see also List of the oldest newspapers)[387][388]
1608:,Telescope: Patent applied for by Hans Lippershey. Actual inventor unknown since it seemed to already be a common item being offered by the spectacle makers in the Netherlands with Jacob Metius also applying for patent and the son of Zacharias Janssen making a claim 47 years later that his father invented it.
1620:,"Compound microscopes, which combine an objective lens with an eyepiece to view a real image, first appear in Europe. Apparently derived from the telescope, actual inventor unknown, variously attributed to Zacharias Janssen (his son claiming it was invented in 1590), Cornelis Drebbel, and Galileo Galilei.[389]"
1630:,Slide rule: invented by William Oughtred[390][391]
1642:,Mechanical calculator. The Pascaline is built by Blaise Pascal.[392]
1643:,"Barometer: invented by Evangelista Torricelli, or possibly up to three years earlier by Gasparo Berti.[393]"
1650:,Vacuum pump: Invented by Otto von Guericke.[394]
1656:,Pendulum clock: Invented by Christiaan Huygens. It was first conceptualized in 1637 by Galileo Galilei but he was unable to create a working model.[395]
1663:,Friction machine: Invented by Otto von Guericke.
1668:,First functional reflecting telescope constructed by Isaac Newton.[396]
1679:,Pressure-cooker: Invented by Denis Papin.[397]
1680:,Christiaan Huygens provides the first known description of a piston engine.[398]
1698:,Thomas Savery develops a steam-powered water pump: for draining mines[399]
1709:,Bartolomeo Cristofori crafts the first piano.
1709:,Daniel Gabriel Fahrenheit invents the alcohol thermometer.
1712:,"Thomas Newcomen builds the first commercial steam engine to pump water out of mines.[400] Newcomen's engine, unlike Thomas Savery's, uses a piston."
1730:,Thomas Godfrey and John Hadley independently develop the octant
1733:,John Kay enables one person to operate a loom with the flying shuttle[401]
1738:,Lewis Paul and John Wyatt invent the first mechanized cotton spinning machine.
1742:,Benjamin Franklin invents the Franklin stove.
1745:,"Musschenbroek and Kleist independently develop the Leyden jar, an early form of capacitor."
1746:,John Roebuck invents the lead chamber process.
1752:,Benjamin Franklin invents the lightning rod.
1755:,William Cullen invents the first artificial refrigeration machine.
1760:,John Joseph Merlin invents the first  Roller skates.[402]
1764:,James Hargreaves invents the spinning jenny.
1765:,James Watt invents the improved steam engine utilizing a separate condenser.
1767:,Joseph Priestley invents a method for the production of carbonated water.
1769:,"Nicolas-Joseph Cugnot invents the first steam-powered vehicle capable of carrying passengers, an early car."
1770:,Richard Salter invents the earliest known design for a weighing scale.
1774:,"John Wilkinson invents his boring machine, considered by some to be the first machine tool."
1775:,Jesse Ramsden invents the modern screw-cutting lathe.
1776:,John Wilkinson invents a mechanical air compressor that would become the prototype for all later mechanical compressors.
1778:,Robert Barron invents the first lever tumbler lock.
1780:,"Hyder Ali of Mysore, India develops the first metal-cylinder rockets.[403]"
1783:,Claude de Jouffroy builds the first steamboat.
1783:,Joseph-Ralf and Jacques-Étienne Montgolfier build the first manned hot air balloon.
1783:,Louis-Sébastien Lenormand invents and uses the first modern parachute.
1785:,Martinus van Marum is the first to use the electrolysis technique.
1786:,Andrew Meikle invents the threshing machine.
1789:,Edmund Cartwright invents the power loom.
1790:,Thomas Saint invents the sewing machine.
1792:,Claude Chappe invents the modern semaphore telegraph.
1793:,Eli Whitney invents the modern cotton gin.
1795:,Joseph Bramah invents the hydraulic press.
1796:,Alois Senefelder invents the lithography printing technique.[404]
1797:,Samuel Bentham invents plywood.
1799:,George Medhurst invents the first motorized air compressor.
1799:,The first paper machine is invented by Louis-Nicolas Robert.
1800:,"Alessandro Volta invents the voltaic pile, an early form of battery in Italy, based on previous works by Luigi Galvani."
1802:,Humphry Davy invents the arc lamp (exact date unclear; not practical as a light source until the invention of efficient electric generators).[405]
1804:,Friedrich Sertürner discovers morphine as the first active alkaloid extracted from the opium poppy plant.[406]
1804:,Joseph Marie Jacquard develops his automated Jacquard loom.[407]
1804:,Richard Trevithick invents the steam locomotive.[408]
1804:,"Hanaoka Seishū creates tsūsensan, the first modern general anesthetic.[409]"
1807:,Nicéphore Niépce invents  an early internal combustion engine capable of doing useful work.
1807:,François Isaac de Rivaz designs the first automobile powered by an internal combustion engine fuelled by hydrogen.
1807:,Robert Fulton expands water transportation and trade with the workable steamboat.
1810:,Nicolas Appert invents the canning process for food.[410]
1810:,Abraham-Louis Breguet creates the first wristwatch.[411]
1811:,"Friedrich Koenig invents the first powered printing press, which was also the first to use a cylinder."
1812:,William Reid Clanny pioneered the invention of the safety lamp which he improved in later years. Safety lamps based on Clanny's improved design were used until the adoption of electric lamps.
1814:,"James Fox invents the modern planing machine, though Matthew Murray of Leeds and Richard Roberts of Manchester have also been credited at times with its invention."
1816:,René Laennec  invents the first Stethoscope.[412]
1816:,Francis Ronalds builds the first working electric telegraph using electrostatic means.
1816:,Robert Stirling invents the Stirling engine.[413]
1817:,"Baron Karl von Drais invents the dandy horse, an early velocipede and precursor to the modern bicycle."
1818:,Marc Isambard Brunel invents the tunnelling shield.
1822:,"Thomas Blanchard invents the pattern-tracing lathe (actually more like a shaper). The lathe can copy symmetrical shapes and is used for making gun stocks, and later, ax handles.[414][415]"
1822:,"Nicéphore Niépce invents Heliography, the first photographic process."
1822:,"Charles Babbage, considered the ""father of the computer"",[416] begins building the first programmable mechanical computer."
1823:,Johann Wolfgang Döbereiner invents the first lighter.
1824:,Johann Nikolaus von Dreyse invents the bolt-action rifle.[417]
1824:,William Sturgeon invents the electromagnet.[418][419]
1826:,John Walker invents the friction match.[420]
1826:,James Sharp invents and goes on to manufacture the first practical gas stove.
1828:,James Beaumont Neilson develops the hot blast process.
1828:,Patrick Bell invents the reaping machine.
1828:,Hungarian physicist Ányos Jedlik invents the first commutated rotary electromechanical machine with electromagnets.
1829:,Louis Braille invents the Braille reading system for the blind.[421]
1829:,William Mann invents the compound air compressor.
1829:,Henry Robinson Palmer is awarded a patent for corrugated galvanised iron.
1830:,Edwin Budding invents the lawn mower.
1831:,Michael Faraday invents a method of electromagnetic induction. It would be independently invented by Joseph Henry the following year. Faraday is credited with inventing the first electric generator called the Faraday disk.
1834:,Moritz von Jacobi invents the first practical electric motor.
1835:,Joseph Henry invents the electromechanical relay.
1837:,Samuel Morse invents Morse code.
1838:,Moritz von Jacobi invents electrotyping.
1839:,William Otis invents the steam shovel.
1839:,James Nasmyth invents the steam hammer.
1839:,"Edmond Becquerel invents a method for the photovoltaic effect, effectively producing the first solar cell."
1839:,Charles Goodyear invents vulcanized rubber.[422]
1839:,Louis Daguerre invents daguerreotype photography.[423]
1840:,John Herschel invents the blueprint.[424]
1841:,Alexander Bain devises a printing telegraph.[425]
1842:,William Robert Grove invents the first fuel cell.
1842:,"John Bennet Lawes invents superphosphate, the first man-made fertilizer."
1844:,"Friedrich Gottlob Keller and, independently, Charles Fenerty come up with the wood pulp method of paper production."
1844:,Francis Rynd invents the hypodermic needle.
1845:,Isaac Charles Johnson invents modern Portland cement.
1846:,Henri-Joseph Maus invents the tunnel boring machine.
1847:,"Ascanio Sobrero invents Nitroglycerin, the first explosive made that was stronger than black powder."
1848:,Jonathan J. Couch invents the pneumatic drill.
1848:,Linus Yale Sr. invents the first modern pin tumbler lock.
1849:,Walter Hunt invents the first repeating rifle to use metallic cartridges (of his own design) and a spring-fed magazine.
1849:,James B. Francis invents the Francis turbine.
1849:,Walter Hunt invents the Safety pin.[426]
1850:,William Armstrong invents the hydraulic accumulator.
1851:,"George Jennings offers the first public flush toilets, accessible for a penny per visit, and in 1852 receives a UK patent for the single piece, free standing, earthenware, trap plumed, flushing, water-closet.[427]"
1852:,Robert Bunsen is the first to use a chemical vapor deposition technique.
1852:,Elisha Otis invents the safety brake elevator.[428]
1852:,"Henri Giffard becomes the first person to make a manned, controlled and powered flight using a dirigible."
1853:,François Coignet invents reinforced concrete.
1855:,"James Clerk Maxwell invents the first practical method for color photography, whether chemical or electronic."
1855:,"Henry Bessemer patents the Bessemer process for making steel, with improvements made by others over the following years."
1856:,"Alexander Parkes invents parkesine, also known as celluloid, the first man-made plastic."
1856:,"James Harrison produces the world's first practical ice making machine and refrigerator using the principle of vapour compression in Geelong, Australia.[429]"
1856:,"William Henry Perkin invents mauveine, the first synthetic dye."
1857:,Heinrich Geissler invents the Geissler tube.
1857:,"The phonautograph, the earliest known device for recording sound, is patented and invented by Frenchman Édouard-Léon Scott de Martinville."
1859:,"Gaston Planté invents the lead acid battery, the first rechargeable battery."
1860:,Joseph Swan produces carbon fibers.[430]
1864:,Louis Pasteur invents the pasteurization process.
1865:,Carl Wilhelm Siemens and Pierre-Émile Martin invented the Siemens-Martin process for making steel.
1867:,"Alfred Nobel invents dynamite, the first safely manageable explosive stronger than black powder."
1867:,"Lucien B. Smith invents barbed wire, which Joseph F. Glidden will modify in 1874, leading to the taming of the West and the end of the cowboys."
1872:,"Polyvinyl chloride, more commonly known as vinyl, is synthesized by German chemist Eugen Baumann"
1872:,J.E.T. Woods and J. Clark invented stainless steel. Harry Brearley was the first to commercialize it.[431]
1873:,Frederick Ransome invents the rotary kiln.
1873:,"William Crookes, a chemist, invents the Crookes radiometer as the by-product of some chemical research."
1873:,"Zénobe Gramme invents the first commercial electrical generator, the Gramme machine."
1874:,Gustave Trouvé invents the first metal detector.
1875:,"Fyodor Pirotsky invents the first electric tram near Saint Petersburg, Russia."
1876:,Nicolaus August Otto invents the four-stroke cycle.
1876:,"Alexander Graham Bell has a patent granted for the telephone. However, other inventors before Bell had worked on the development of the telephone and the invention had several pioneers.[432]"
1877:,Thomas Edison invents the first working phonograph.[433]
1878:,Henry Fleuss is granted a patent for the first practical rebreather.[434]
1878:,Lester Allan Pelton invents the Pelton wheel.
1879:,"Joseph Swan and Thomas Edison both patent a functional incandescent light bulb. Some two dozen inventors had experimented with electric incandescent lighting over the first three-quarters of the 19th century but never came up with a practical design.[435] Swan's, which he had been working on since the 1860s, had a low resistance so was only suited for small installations. Edison designed a high-resistance bulb as part of a large-scale commercial electric lighting utility.[436][437][438]"
1881:,"Nikolay Benardos presents carbon arc welding, the first practical arc welding method.[439]"
1884:,"Hiram Maxim invents the recoil-operated Maxim gun, ushering in the age of semi- and fully automatic firearms."
1884:,"Paul Vieille invents Poudre B, the first smokeless powder for firearms."
1884:,Sir Charles Parsons invents the modern steam turbine.
1884:,"Hungarian engineers Károly Zipernowsky, Ottó Bláthy and Miksa Déri invent the closed core high efficiency transformer and the AC parallel power distribution."
1885:,John Kemp Starley invents the modern safety bicycle.[440][441]
1886:,"Carl Gassner invents the zinc–carbon battery, the first dry cell battery, making portable electronics practical."
1886:,Charles Martin Hall and independently Paul Héroult invent the Hall–Héroult process for economically producing aluminum in 1886.
1886:,Karl Benz invents the first petrol or gasoline powered auto-mobile (car).[442]
1887:,Carl Josef Bayer invents the Bayer process for the production of alumina.
1887:,James Blyth invents the first wind turbine used for generating electricity.
1887:,"John Stewart MacArthur, working in collaboration with brothers Dr. Robert and Dr. William Forrest, develops the process of gold cyanidation."
1888:,John J. Loud invents the ballpoint pen.[443]
1888:,Thomas Edison and William Kennedy Dickson invent the Kinetoscope.[444]
1888:,Heinrich Hertz publishes a conclusive proof of James Clerk Maxwell's electromagnetic theory in experiments that also demonstrate the existence of radio waves. The effects of electromagnetic waves had been observed by many people before this but no usable theory explaining them existed until Maxwell.
1888:,"The first practical pneumatic tire was made by Scotsman John Boyd Dunlop, the patent was from 1847 by Robert William Thomson"
1890s:,Frédéric Swarts invents the first chlorofluorocarbons to be applied as refrigerant.[445]
1890:,Robert Gair would invent the pre-cut cardboard box.[446]
1891:,Whitcomb Judson invents the zipper.
1892:,Léon Bouly invents the cinematograph.
1892:,Thomas Ahearn invents the electric oven.[447]
1893:,Rudolf Diesel invents the diesel engine (although Herbert Akroyd Stuart had experimented with compression ignition before Diesel).
1893:,"William Stewart Halsted, invents the rubber glove for his wife Caroline Hampton as he noticed her hands were affected by the daily surgeries she had performed. The gloves were intended to prevent medical staff from developing dermatitis from surgical chemicals.[448][449][450] The first modern disposable glove was created by Ansell Rubber Co. Pty. Ltd. in 1965.[451][452][453]"
1895:,Guglielmo Marconi invents a system of wireless communication using radio waves.
1895:,Wilhelm Conrad Röntgen invented the first radiograph (X-ray).
1897:,"Surgical masks made of cloth were developed in Europe by physicians Jan Mikulicz-Radecki at the University of Breslau and Paul Berger in Paris, as a result of increasing awareness of germ theory and the importance of antiseptic procedures in medicine.[454]"
1898:,"Hans von Pechmann synthesizes polyethylene, now the most common plastic in the world.[455]"
1899:,Waldemar Jungner invents the rechargeable nickel-cadmium battery (NiCd) as well as the nickel-iron electric storage battery (NiFe) and the rechargeable alkaline silver-cadmium battery (AgCd)
1900:,The first Zeppelin is designed by Theodor Kober.
1901:,"The first motorized cleaner using suction, a powered ""vacuum cleaner"", is patented independently by Hubert Cecil Booth and David T. Kenney.[456]"
1903:,The first successful gas turbine is invented by Ægidius Elling.
1903:,Édouard Bénédictus invents laminated glass.
1903:,"First sustained and controlled heavier-than-air powered flight achieved by an airplane flown at Kitty Hawk, North Carolina by Orville and Wilbur Wright. See Claims to the first powered flight."
1904:,"The Fleming valve, the first vacuum tube and diode, is invented by John Ambrose Fleming."
1907:,The first free flight of a rotary-wing aircraft is carried out by Paul Cornu.
1907:,"Leo Baekeland invents bakelite,  the first plastic made from synthetic components."
1907:,The tuyères thermopropulsives[457] after 1945 (Maurice Roy (fr)) known as the statoreacteur[457][458] a combustion subsonique (the ramjet)[459] – R. Lorin[460][461][462]
1908:,Cellophane is invented by Jacques E. Brandenberger.
1909:,Fritz Haber invents the Haber process.
1909:,"The first instantaneous transmission of images, or television broadcast, is carried out by Georges Rignoux and A. Fournier."
1911:,"The cloud chamber, the first particle detector, is invented by Charles Thomson Rees Wilson."
1912:,The first commercial slot cars or more accurately model electric racing cars operating under constant power were made by Lionel (USA) and appeared in their catalogues in 1912.
1912:,The first use of articulated trams by Boston Elevated Railway.
1913:,The Bergius process is developed by Friedrich Bergius.
1913:,The Kaplan turbine is invented by Viktor Kaplan.
1915:,"Harry Brearley invents a process to create Martensitic stainless steel, initially labelled Rustless Steel, later marketed as Staybrite, and AISI Type 420.[463]"
1915:,"The first operational military tanks are designed in Great Britain and France. They are used in battle from 1916 and 1917 respectively. The designers in Great Britain are Walter Wilson and William Tritton and in France, Eugène Brillié. (Although it is known that vehicles incorporating at least some of the features of the tank were designed in a number of countries from 1903 onward, none reached a practical form.)"
1916:,"The Czochralski process, widely used for the production of single crystal silicon, is invented by Jan Czochralski."
1917:,The crystal oscillator is invented by Alexander M. Nicholson using a crystal of Rochelle Salt although his priority was disputed by Walter Guyton Cady.
1925:,The Fischer–Tropsch process is developed by Franz Fischer and Hans Tropsch at the Kaiser-Wilhelm-Institut für Kohlenforschung.
1926:,"The Yagi-Uda Antenna or simply Yagi Antenna is invented by Shintaro Uda of Tohoku Imperial University, assisted by his colleague Hidetsugu Yagi. The Yagi Antenna was widely used during World War II. After the war they saw extensive development as home television antennas."
1926:,Robert H. Goddard launches the first liquid fueled rocket.
1926:,"Harry Ferguson, patents the Three-point hitch equipment linkage system for tractors.[464]"
1926:,John Logie Baird demonstrates the world's first live working television system.[465][466][467]
1927:,The quartz clock is invented by Warren Marrison and J.W. Horton at Bell Telephone Laboratories.[468]
1928:,"Penicillin is first observed to exude antibiotic substances by Nobel laureate Alexander Fleming. Development of medicinal penicillin is attributed to a team of medics and scientists including Howard Walter Florey, Ernst Chain and Norman Heatley."
1928:,"Frank Whittle formally submitted his ideas for a turbo-jet engine. In October 1929, he developed his ideas further.[469] On 16 January 1930, Whittle submitted his first patent (granted in 1932).[470]"
1928:,Philo Farnsworth demonstrates the first practical electronic television to the press.
1929:,The ball screw is invented by Rudolph G. Boehm.
1930:,The Supersonic combusting ramjet — Frank Whittle.[citation needed]
1930:,The Phase-contrast microscopy is invented by Frits Zernike.
1931:,The electron microscope is invented by Ernst Ruska.
1933:,FM radio is patented by inventor Edwin H. Armstrong.
1933:,"Harry C. Jennings Sr. and Herbert Everest, both mechanical engineers, invented the first lightweight, steel, folding, portable wheelchair with their ""X-brace"" design.[471][472]"
1935:,"Nylon, the first fully synthetic fiber is produced by Wallace Carothers while working at DuPont.[473]"
1938:,"Z1, built by Konrad Zuse, is the first freely programmable computer in the world."
1938:,"Nuclear fission discovered in experiment by chemists Otto Hahn and Fritz Strassmann and physicists Lise Meitner and Otto Robert Frisch. The German nuclear energy project was based on this research. The Tube Alloys project and, subsequently, the Manhattan Project and the Soviet atomic bomb project were influenced by this research."
1939:,G. S. Yunyev or Naum Gurvich invented the electric current defibrillator
1940:,Pu-239 isotope (isotope of plutonium)[474][475] a form of matter existing with the capacity for use as a destructive element[476] (because the isotope has an exponentially increasing[474] spontaneous[477] fissile decay[478]) within nuclear devices — Glenn Seaborg.[475]
1940:,"John Randall and Harry Boot would develop the high power, microwave generating, cavity magnetron, later applied to commercial Radar and Microwave oven appliances.[479]"
1941:,Polyester is invented by John Rex Whinfield and James Dickson.[480]
1942:,"The V-2 rocket, the world's first long range ballistic missile, developed by engineer Wernher von Braun."
1944:,The non-infectious viral vaccine is perfected by Dr. Jonas Salk and Thomas Francis.[481]
1945:,"The atomic bomb is developed by the Manhattan Project and swiftly used in August 1945 in the atomic bombings of Hiroshima and Nagasaki, effectively ending World War II."
1945:,"Percy Spencer, while employed at Raytheon, would patent a magnetron based microwave oven.[482]"
1945:,"Willard Libby began his work on radiocarbon dating. He published his paper in 1946,[483][484] a second paper in Science in 1947.[483][485] Libby and James Arnold succeeded with the radiocarbon dating theory after results were published in Science in December 1949.[486][487]"
1946:,"James Martin invents the ejector seat, inspired by the death of his friend and test pilot Captain Valentine Baker in an aeroplane crash in 1942."
1947:,Holography is invented by Dennis Gabor.
1947:,Floyd Farris and J.B. Clark (Stanolind Oil and Gas Corporation) invents hydraulic fracturing technology.[488]
1947:,"The first transistor, a bipolar point-contact transistor, is invented by John Bardeen and Walter Brattain under the supervision of William Shockley at Bell Labs."
1948:,The first atomic clock is developed at the National Bureau of Standards.
1948:,"Basic oxygen steelmaking is developed by Robert Durrer. The majority of steel manufactured in the world is produced using the basic oxygen furnace; in 2000, it accounted for 60% of global steel output.[489]"
1950:,"Bertie the Brain, debatably the first video game, is displayed to the public at the Canadian National Exhibition."
1950:,The Toroidal chamber with axial magnetic fields (the Tokamak) is developed by Igor E. Tamm and Andrei D. Sakharov.[490]
1952:,The float glass process is developed by Alastair Pilkington.[491]
1952:,The first thermonuclear weapon is developed.
1953:,"The first video tape recorder, a helical scan recorder, is invented by Norikazu Sawazaki."
