Year,Content
1954:,"Invention of the solar battery by Bell Telephone scientists, Calvin Souther Fuller, Daryl Chapin and Gerald Pearson capturing the Sun's power. First practical means of collecting energy from the Sun and turning it into a current of electricity."
1955:,The hovercraft is patented by Christopher Cockerell.
1955:,The intermodal container is developed by Malcom McLean.
1956:,The hard disk drive is invented by IBM.[492]
1956:,"The Logic Theorist computer program, the first ""artificial intelligence program"", was written and invented by Allen Newell, Herbert A. Simon, and Cliff Shaw.[493]"
1957:,The laser and optical amplifier are invented and named by Gordon Gould and Charles Townes. The laser and optical amplifier are foundational to powering the Internet.[494]
1957:,"The first personal computer used by one person and controlled by a keyboard, the IBM 610, is invented by IBM."
1957:,"The first artificial satellite, Sputnik 1, is launched."
1958 – 1959:,The integrated circuit is independently invented by Jack Kilby and Robert Noyce.
1959:,"The MOSFET (MOS transistor) is invented by the Egyptian Mohamed Atalla and the Korean Dawon Kahng at Bell Labs. It is used in almost all modern electronic products. It was smaller, faster, more reliable and cheaper to manufacture than earlier bipolar transistors, leading to a revolution in computers, controls and communication.[495][496][497]"
1960:,The first functioning laser is invented by Theodore Maiman.
1963:,The first electronic cigarette is created by Herbert A. Gilbert. Hon Lik is often credited with its invention as he developed the modern electronic cigarette and was the first to commercialize it.
1964:,"Shinkansen, the first high-speed rail commercial passenger service."
1965:,Kevlar is invented by Stephanie Kwolek at DuPont.
1969:,"The NPL network followed by the ARPANET implement packet switching for data communication,[498][499] drawing on the concepts and designs of Donald Davies,[500][501][502] and Paul Baran.[503] These are considered precursors to the modern Internet.[500][503]"
1970s:,"Public-key cryptography is invented and developed by James H. Ellis, Clifford Cocks, Malcolm J. Williamson, Whitfield Diffie, Martin Hellman, Ralph Merkle, Ron Rivest, Adi Shamir, Leonard Adleman, et al."
1970:,The pocket calculator is invented.
1971:,"The first single-chip microprocessor, the Intel 4004, is invented. Its development was led by Federico Faggin, using his silicon-gate MOS technology. This led to the personal computer (PC) revolution.[504]"
1971:,"The first space station, Salyut 1, is launched."
1971:,IBM developed and released the world's first floppy disk and disk drive.[505]
1972:,"The first video game console, used primarily for playing video games on a TV, is the Magnavox Odyssey.[506]"
1973:,The first fiber optic communication systems were developed by Optelecom.[507]
1973:,The first commercial graphical user interface is introduced in 1973 on the Xerox Alto. The modern GUI is later popularized by the Xerox Star and Apple Lisa.
1973:,The first capacitive touchscreen is developed at CERN.
1974:,"The Transmission Control Program is proposed by Vinton Cerf and Robert E. Kahn, building on the work of Louis Pouzin and other Internet pioneers, creating the basis for the modern Internet.[508][509]"
1974:,"The lithium-ion battery is invented by M. Stanley Whittingham, and further developed in the 1980s and 1990s by John B. Goodenough, Rachid Yazami and Akira Yoshino. It has impacted modern consumer electronics and electric vehicles.[510]"
1974:,The Rubik's cube is invented by Ernő Rubik which went on to be the best selling puzzle ever.[511]
1977:,Dr Walter Gilbert and Frederick Sanger invented a new DNA sequencing method for which they won the Nobel Prize.[512]
1977:,The first self-driving car that did not rely upon rails or wires under the road is designed by the Tsukuba Mechanical Engineering Laboratory.[513]
1978:,"The Global Positioning System (GPS) enters service. While not the first Satellite navigation system, it is the first to enter widespread civilian use."
1979:,"The first handheld game console with interchangeable game cartridges, the Microvision is released."
1979:,Nippon Telegraph and Telephone (NTT) launched the first cellular network in Japan.[514]
1979:,"Public dialup information, messaging and e-commerce services, were pioneered through CompuServe and RadioShack's MicroNET, and the UK's Post Office Telecommunications Prestel services.[515][516]"
1980:,Flash memory (both NOR and NAND types) was invented by Fujio Masuoka while working for Toshiba. It was formally introduced to the public in 1984.
1980:,"Scientists Mark Skolnick, Ron Davis, Ray White, and David Botstein published their findings on a gene mapping tool using Restriction Fragment-length Polymorphisms (RFLP), that would have applications to identify heritable disorders, including some forms of cancer.[517][518][519]"
1981:,"The first reusable spacecraft, the Space Shuttle undergoes test flights ahead of full operation in 1982."
1981:,"Kane Kramer develops the credit card-sized, IXI digital media player.[520]"
1981:,"Televerket, a Swedish state-owned corporation, launched the Nordic Mobile Telephone (NMT) system.[521][522][523]"
1981:,"Comvik, a Swedish telecommunications company, launched the first commercial automatic cellular system. However, according to the Swedish Post and Telecom Authority, the company launched an unlicensed automatic system. Comvik didn’t receive a license to operate until December 1981, two months after the NMT system was launched.[524][525]"
1982:,"A CD-ROM contains data accessible to, but not writable by, a computer for data storage and music playback. The 1985 Yellow Book standard developed by Sony and Philips adapted the format to hold any form of binary data.[526]"
1982:,"Direct to home satellite television transmission, with the launch of Sky One service.[527]"
1982:,"The first laptop computer is launched, the 8/16-bit Epson HX-20.[528]"
1983:,Stereolithography is invented by Chuck Hull.[529]
1983:,"Ameritech, now known as AT&T, commercialized the Bell System (its cellular network) in Chicago, Ill.[530][531]"
1984:,"The first commercially available cell phone in the US, the DynaTAC 8000X, is created by Motorola."
1984:,DNA profiling is pioneered by Alec Jeffreys.[532][533]
1986:,"Technophone, a British mobile phone company, created the first pocket-sized cell phone, the Excell PCT105.[534][535]"
1989:,"Karlheinz Brandenburg would publish the audio compression algorithms that would be standardised as the: MPEG-1, layer 3 (mp3), and later the MPEG-2, layer 7 Advanced Audio Compression (AAC).[536]"
1989:,The World Wide Web is invented by computer scientist Tim Berners-Lee.[537][538]
1990:,The Neo Geo AES becomes the first video game system to launch that used Memory Cards.
1990:,"The first search engine invented was “Archie”, created by Alan Emtage a student at McGill University in Montreal."
1991:,The first commercial flash-based solid-state drive is launched by SunDisk.[539]
1991:,The first sim card is developed by Munich smart-card maker Giesecke & Devrient.
1993:,IBM created the first mobile app with SIMON; it had 10 built-in apps from Email to Calendar.
1994:,"IBM Simon, the world's first smartphone, is developed by IBM."
1994:,First generation of Bluetooth is developed by Ericsson Mobile. A form of data communication on short distances between electronic devices.
1994:,A Tetris variant on the Hagenuk MT-2000 device becomes the first mobile game.
1995:,"DVD is an optical disc storage format, invented and developed by Philips, Sony, Toshiba, and Panasonic in 1995. DVDs offer higher storage capacity than compact discs while having the same dimensions."
1995:,Match.com launches as the first dating site ever and is the number 1 most visited dating site in the US.
1995:,Waiter.com launches as the first online food ordering service.
1996:,"The Ciena Corporation, in partnership with Sprint, deployed the first commercial dense wavelength-division multiplexing system, which created the massive capacity of the Internet.[540][541][542]"
1996:,"Mobile web was first commercially offered in Finland on the Nokia 9000 Communicator phone, and it was also the first phone with texting."
1996:,Bolt and Six Degrees (1997) both become the first social media sites.
1996:,"Myriad Genetics released the BRACAnalysis, the first commercial genetic test for assessing the risk of hereditary breast and ovarian cancer.[543][544]"
1997:,"The first weblog, a discussion or informational website, was created by Jorn Barger, and later shortened to ""blog"" in 1999 by Peter Merholz."
1998:,The first portable MP3 player was released by SaeHan Information Systems.
1998:,"The search engine Google, is launched.[545]"
1999:,"The first digital video recorder (DVR), the TiVo, is launched by Xperi."
1999:,"NTT DoCoMo launches i-mode, the first integrated Online App store for mobile phones."
2000:,Sony develops the first prototypes for the Blu-ray optical disc format. The first prototype player was released in 2004.
2000:,"First documented placement of Geocaching, an outdoor recreational activity, in which participants use a Global Positioning System (GPS) receiver or mobile device and other navigational techniques to hide and seek containers, took place on May 3, 2000, by Dave Ulmer of Beavercreek, Oregon."
2004:,"First podcast, invented by Adam Curry and Dave Winer, is a program made available in digital format for download over the Internet and it usually features one or more recurring hosts engaged in a discussion about a particular topic or current event.[546][547][548]"
2005:,"YouTube, the first popular video-streaming site, was founded"
2007:,Netflix debuted the first popular video-on-demand service
2007:,Apple Inc. released the iPhone
2007:,The Bank of Scotland develops the world's first banking app
2007:,"SoundCloud, the first on-demand service to focus on music is debuted"
2007:,"First Kindle introduced by Amazon (company) founder and CEO Jeff Bezos, who instructed the company's employees to build the world's best e-reader before Amazon's competitors could. Amazon originally used the codename Fiona for the device. This hardware evolved from the original Kindle introduced in 2007 and the Kindle DX (with its larger 9.7"" screen) introduced in 2009.[549]"
2008:,Satoshi Nakamoto develops the first blockchain.[550]
2010:,"The first solar sail based spacecraft, IKAROS.[551]"
2010:,The first quantum machine[552]
2010:,"The first synthetic organism, Mycoplasma laboratorium is created by the J. Craig Venter Institute"
2011:,HIV treatment as prevention (HPTN 052)[553]
2013:,Cancer immunotherapy[554]
2014:,"The first known ""NFT"", Quantum,[555] was created by Kevin McCoy and Anil Dash in May 2014, that explicitly linked a non-fungible, tradable blockchain marker to a work of art, via on-chain metadata (enabled by Namecoin).[556]"
2015:,CRISPR genome-editing method[557]
2017:,"Google publishes a research paper ""Attention Is All You Need"" leading to the development into a new deep learning architecture known as the transformer.[558]"
2018:,Single-cell sequencing[559]
2019:,"IBM launches IBM Q System One, its first integrated quantum computing system for commercial use."
2020:,The first MRNA vaccine to be approved by public health medicines regulators is co-developed by Pfizer and BioNTech for COVID-19.[560]
2020:,OpenAI demonstrated an Artificial Intelligence model called GPT-3. The program was created to generate human-like responses when given prompts.[561]
2021:,Pfizer develops the world's first pill for COVID.
2022:,"ChatGPT is launched to the public, making its first mainstream generative AI to be released."
